{
  "document_type": "PRD",
  "title": "Appointment as a Multi-Service Primitive",
  "target_assistant": "Claude",
  "optimization_goal": "Engineering implementation",
  "status": "approved",
  "autonomous_execution_protocol": {
    "directive": "CRITICAL: YOU ARE OPERATING AS AN AUTONOMOUS SENIOR SOFTWARE ENGINEER. READ AND FOLLOW THESE RULES ABSOLUTELY.",
    "interactivity_rules": [
      "DO NOT halt execution to ask for permission, clarification, or human validation on minor implementation details.",
      "DO NOT ask the user to run bash commands, install dependencies, provision resources, or update configuration. Run them yourself using your available tools.",
      "If you need to check a file, inspect a schema, or run a test, use your tools immediately without reporting a staging message first.",
      "Stop and ask ONLY when a decision materially affects architecture, public APIs, data models, security, or user-visible behavior in a way this PRD does not already settle."
    ],
    "error_handling_loop": [
      "If a command, script, or unit test fails: read the full traceback/stdout.",
      "Do not output 'Please fix this' or 'Run X to resolve.'",
      "Formulate a fix directly, modify the file, re-run your verification command, and iterate autonomously until it passes.",
      "Only return control if an irreconcilable structural failure occurs that breaks core data-safety boundaries."
    ],
    "definition_of_done": [
      "Conclude a phase only when every story in that phase is written, syntactically clean, locally verified against its success_tests (pytest), and integrated.",
      "Keep domain logic pure and out of handlers; schemas remain the source of truth for document bodies.",
      "Provide a single, comprehensive final report at the end of the run detailing file changes, schema mutations, and test results."
    ]
  },
  "source_material": [
    {
      "type": "attached_plan",
      "file_id": "plans/BOOKING_AS_PRIMITIVE.md",
      "title": "Booking as a First-Class Primitive"
    }
  ],
  "product_summary": {
    "problem_statement": "The appointment entity is 1:1 with a single service (appointment.service_id is singular). This makes two real situations impossible: (a) one visit covering multiple services (tax prep + notary in the same slot), and (b) a service that requires no booking at all (a taxable fluid top-off bundled with an oil change). Services-in-offers shipped the same day this flaw was found, so there is no legacy data or frozen client to preserve.",
    "product_goal": "Make the appointment a multi-service primitive. appointment.services[] (minItems 1) is the single canonical shape. A Service declares fulfillment_mode (scheduled | no_booking). The Offer coordinates delivery via service_booking_mode (single_visit | separate_visits). One purchase produces 1..N appointments plus 0..N no_booking invoice lines, driven by Stripe webhooks as the source of truth for payment."
  },
  "non_goals": [
    "Multi-fulfiller single visit (multi-resource scheduling): different delegates performing different services within the same visit. v1 restricts a combined appointment to one fulfiller (or unassigned).",
    "Per-item booking_group on offers (mixing combine and separate within one offer). v1 uses the offer-wide service_booking_mode only.",
    "Optional combined-duration override/buffer for shared setup. v1 combined duration is the strict sum of line durations.",
    "Bill-on-completion / installment invoicing. v1 is one invoice per purchase.",
    "Per-service tax categories and reporting. Tracked separately with the commerce tax/fee work.",
    "Per-line status/completion lifecycle. v1 appointment status is visit-level (single fulfiller).",
    "Renaming the appointment entity to Booking. 'booking' remains the verb/flow (booking.py, booking_page, booking_flow).",
    "Introducing primary_index. Not a v1 field; services[0] is the representative line."
  ],
  "core_principles": [
    "services[] is the single source of truth. appointment.services[] has minItems 1. No scalar service_id/service_name, no mirror, no read adapter. A single service is a one-element array.",
    "Greenfield: no back-compat. Any stray test appointments are wiped or backfilled once, then forgotten.",
    "The Offer coordinates the 'how'; the Service declares 'whether it books'; a future per-item field is a finer grain of the Offer's grouping, never a competing knob.",
    "no_booking is a Service, not a Product, for tax/fiscal reasons.",
    "Stripe webhooks are the source of truth for payment-triggered state. Event handlers are idempotent and order-independent.",
    "Cite existing schemas and the state machine for enumerations; the PRD pins only new or changed behavior and genuinely new state.",
    "Omit derivable defaults: primary_index absent implies 0; rule_snapshot present only when a delegate is assigned."
  ],
  "data_model": {
    "appointment": {
      "persistent_identifier": "appointment_id",
      "canonical_fields": [
        "appointment_id",
        "tenant_id",
        "services[]",
        "starts_at",
        "ends_at",
        "timezone",
        "fulfiller_id",
        "duration_minutes",
        "status",
        "payment_status",
        "awaiting_schedule",
        "customer",
        "order_id",
        "offer_id",
        "invoice_id",
        "page_id",
        "source"
      ],
      "service_line_schema": {
        "required_fields": ["service_id", "price_id", "duration_minutes"],
        "optional_fields": ["fulfiller_id", "rule_snapshot"],
        "constraints": [
          "services[] has minItems 1.",
          "No scalar service_id/service_name on the appointment; readers use services[] (services[0] is the representative line).",
          "duration_minutes is required on every services[] line (all lines are scheduled by construction); appointment.duration_minutes equals the sum of the line durations.",
          "No no_booking service ever appears in services[]; no_booking services are invoice lines, never appointment lines.",
          "primary_index is NOT a v1 field. If ever introduced it is an integer index into services[], absent implies 0, validated in-range only when present, and never a duplicate id."
        ]
      }
    },
    "service": {
      "new_field": "fulfillment_mode",
      "allowed_values": ["scheduled", "no_booking"],
      "rules": [
        "Default is scheduled.",
        "duration_minutes is optional/absent when no_booking; required when scheduled.",
        "scheduled services keep duration_minutes, fulfiller/calendar routing, and check-in/completion rules.",
        "no_booking services are taxed as services and route to a fulfiller for payout only (no scheduling)."
      ]
    },
    "offer": {
      "new_field": "service_booking_mode",
      "allowed_values": ["single_visit", "separate_visits"],
      "rules": [
        "Default is single_visit.",
        "single_visit: all scheduled services in the offer collapse into one appointment. separate_visits: each scheduled service becomes its own appointment.",
        "service_booking_mode is shorthand expanded into per-item booking groups by a single resolver, booking_groups_for(offer).",
        "Relax the (added-today) one-service-item cap to allow N service items per offer.",
        "no_booking services in the offer are fulfilled (invoice line + payout), never booked.",
        "Per-item booking_group is reserved for a future phase; when added, an explicit item group wins, else falls back to the mode-derived default."
      ]
    },
    "invoice": {
      "source_linkage": [
        "The source anchor is the purchase (checkout_session_id / order id) and is always present.",
        "source.appointment_ids[] is the fan-out set of scheduled appointments (0..N); it may be empty for a no_booking-only purchase.",
        "No scalar source.appointment_id; a single-appointment purchase is a one-element appointment_ids[]."
      ],
      "line_item_rules": [
        "A no_booking purchase is represented as an invoice line only: no separate fulfillment record and no timeless appointment.",
        "An assigned no_booking line carries fulfiller_id + rule_snapshot (frozen at webhook time); an unassigned line carries neither (tenant/business revenue).",
        "Each no_booking line carries fulfillment_status (default 'fulfilled'; 'pending' for async). no_booking lines have no duration_minutes (no scheduling/payout/tax role)."
      ]
    }
  },
  "scope": {
    "in_scope": [
      "Appointment.schema services[] (minItems 1) replacing scalar service_id; per-line duration; appointment duration rollup.",
      "Service.fulfillment_mode (scheduled | no_booking).",
      "Offer.service_booking_mode and relaxing the one-service-item cap; booking_groups_for(offer) resolver.",
      "Checkout metadata carrying all scheduled lines + no_booking lines + service_booking_mode.",
      "Webhook fan-out to 1..N appointments; no_booking fulfillment as enriched invoice lines; invoice.paid fan-out.",
      "Scheduling 1..N appointments; summed-duration availability; invoice_from_order for book_then_pay.",
      "Cancel/reschedule/view for multi-line and multi-appointment purchases."
    ],
    "out_of_scope": [
      "Multi-fulfiller single visit and multi-resource availability.",
      "Per-item booking_group and mixed combine/separate offers.",
      "Combined-duration override/buffer.",
      "Bill-on-completion / installment invoicing.",
      "Per-service tax categories.",
      "Per-line completion lifecycle.",
      "Appointment entity rename."
    ]
  },
  "entry_points": [
    {
      "name": "reserve",
      "mode": "sync",
      "flow_type": "book_then_pay (direct or offer reserve)",
      "shape": "services[]",
      "fan_out": false,
      "notes": [
        "Creates a services[]-shaped appointment. Direct booking = one line.",